author,published,title,subtitle,url
Kocsmár-Tóth István,2024.06.08. 19:52,"A főpróbát megnyerte, a kényszerből lecserélt Szoboszlait lehet, elvesztette a válogatott",A csapatkapitány szűk 60 perc után kért cserét az idényben több gondot is okozó bal combját fájlalva.,https://index.hu/sport/futball/2024/eb/2024/06/08/magyarorszag-izrael-felkeszulesi-merkozes-europa-bajnoki-foproba-debrecen-nagyerdo/
,,Szoboszlai Dominik: Nem akartam ezt tovább csinálni,"A válogatott csapatkapitány elmondta, milyen állapotban van.",https://index.hu/sport/futball/2024/eb/2024/06/08/felkeszulesi-merkozes-magyarorszag-izrael-nyilatkozatok-marco-rossi-szoboszlai-dominik-bolla-bendeguz/
,,Véget ért Dobrev Klára 36 órás kampánykörútja,Szigetszentmiklóson zárt a DK-MSZP-Párbeszéd listavezetője.,https://index.hu/kulfold/ep/2024/valasztas/2024/06/08/dobrev-klara-dk-mszp-parbeszed-ep-listavezeto-kampanykorut-valasztas/
,,"Krausz Gábor üzent a választóknak, a Békemenet is felvillan a videóban","Azért ment szakácsnak, hogy ne kelljen elmennie sorkatonai szolgálatra.",https://index.hu/fomo/2024/06/08/krausz-gabor-sef-valasztas-szavazas-bekemenet-haboru-beke/
,,"Meghalt egy 13 éves fiú, miután rosszul lett egy komáromi osztálykiránduláson","A gyerekek azon versenyeztek, ki tud tovább víz alatt maradni.",https://index.hu/belfold/2024/06/08/halaleset-komarom-osztalykirandulas-szabadidopark-orszagos-mentoszolgalat/
,,Orbán Ráhel is megosztotta Vitézy Dávid bejegyzését,Közösségi oldalán reklámozta az LMP főpolgármester-jelöltjét.,https://index.hu/belfold/2024/onkormanyzati_valasztas/2024/06/08/karacsony-gergely-vitezy-david-orban-viktor-rahel-kampany/
,,Felhívást tett közzé a rendőrség a választások miatt,Rendkívüli nyitvatartás lesz több határátkelőhelyen.,https://index.hu/kulfold/ep/2024/valasztas/2024/06/08/hataratkelo-megnyitas-valasztas-rendorseg/
Marton Máté,2024.06.08. 19:18,Tekernek a törökök a tagságért egy nemzetközi felmérés szerint,Egyre több uniós és nem uniós állampolgár viszonyul negatívan Brüsszelhez.,https://index.hu/kulfold/2024/06/08/kutatas-europai-unio-velemeny-magyarorszag-nemetorszag-spanyolorszag-lengyelorszag-torokorszag-usa/
,,"Magyarország lett a filmgyártás fellegvára, milliárdokat spórolnak a stúdiók",Csak a Dűne 2. közel 15 milliárd forintos adó-visszatérítést kapott.,https://index.hu/fomo/2024/06/08/magyarorszag-filmgyartas-adokedvezmeny-forgatas/
,,Ötméteres piton nyelt le egy 45 éves nőt Indonéziában,"A helyiek megölték a kígyót, és felhasították a testét.",https://index.hu/belfold/2024/06/08/kigyo-piton-indonezia-halaleset/
,,A Budapest Pride szervezői nem örülnek Vitézy Dávid reakciójának,"Az idei Pride-on nem lesz ott, viszont a 2025-ösön igen, ha megválasztják.",https://index.hu/belfold/2024/onkormanyzati_valasztas/2024/06/08/budapest-pride-lmbtq-karacsony-gergely-budapest-kampany-vitezy-david/
,,Karácsony Gergely: A város szabadságának megőrzése a tét,A fővárosi kerületek vezetőivel együtt üzent a választóknak.,https://index.hu/belfold/2024/onkormanyzati_valasztas/2024/06/08/karacsony-gergely-valasztas-budapest-soproni-tamas-piko-andras-niedermuller-peter/
,,"Naptárbaki: Ferencváros polgármestere már szombaton számonkérte követőit, voltak-e szavazni",Azóta gyorsan törölték a posztot.,https://index.hu/belfold/2024/onkormanyzati_valasztas/2024/06/08/baranyi-krisztina-facebook-szavazas-baki-poszt-torles/
,,"Ismét lecsapott az Iszlám Állam, legalább 60 ember meghalt",A terrorszervezet keresztényeket vett célba.,https://index.hu/kulfold/2024/06/08/kongoi-demokratikus-koztarsasag-iszlamista-fegyveresek-iszlam-allam-tamadas/
Szalai Szabolcs,2024.06.08. 18:14,"„A Fidesz fog győzni sajnos, de megszorongatjuk őket!”",A Tisza Párt támogatóit kérdeztük Magyar Péter Hősök terére szervezett tüntetésén a vasárnapi választásról.,https://index.hu/belfold/2024/onkormanyzati_valasztas/2024/06/08/magyar-peter-tisza-part-tuntetes-hosok-tere-valasztas-eredmeny-video/
,,Détár Enikő a válásáról: Nagy törés volt,A színésznő mesélt Rékasi Károly balesetéről és jelenlegi kapcsolatáról is.,https://index.hu/kultur/2024/06/08/detar-eniko-rekasi-karoly-baleset-valas-interju-szinesz-szineszno-szinhaz/
,,"Ez a film akkora marhaság, hogy csak nevetni tudtunk rajta",A kártya okozza a sorozatos haláleseteket.,https://index.hu/kultur/cinematrix/2024/06/08/halalkartya-cinematrix-tarot-kritika/
,,Így készül a történelmi napra az Index,"Minden, amit a választásról tudni érdemes, elérhető az Indexen.",https://index.hu/belfold/2024/06/08/onkormanyzati-valasztas-ep-valasztas-index-jeloltek-kampany-valasztas/
,,"Főpróbát tartott válogatottunk, három góllal győzte le Izraelt",Marco Rossi együttese Debrecenben lépett pályára utolsó felkészülési mérkőzésén.,https://index.hu/sport/futball/2024/eb/2024/06/08/eb-2024-felkeszulesi-merkozes-magyarorszag-izrael-percrol-percre-kozvetites/
Holló Bettina,2024.06.08. 17:19,A pszichiátriai ellátás bukása vagy szélsőséges eset az eutanáziát kérő fiatal nő története?,"A 29 éves nő azután hozta meg a döntését, hogy a szakemberek is lemondtak róla.",https://index.hu/belfold/2024/06/08/zoraya-ter-beek-eutanazia-hollandia-mentalis-betegseg-karsai-daniel/
,,Ezeket az iratokat kell bemutatni a szavazásnál,Idén már nem kell minden választástípus névjegyzékét külön aláírni.,https://index.hu/belfold/2024/onkormanyzati_valasztas/2024/06/08/valasztas-szavazas-europai-parlament-onkormanyzat-szavazolap-alairas/
,,Lázár János videón mutatta be a „telefonbetyárkodását”,Deutsch Tamás és Gulyás Gergely is csatlakozott hozzá.,https://index.hu/belfold/2024/onkormanyzati_valasztas/2024/06/08/lazar-janos-video-telefonbetyar-mozgositas-fidesz-deutsch-tamas-gulyas-gergely/
,,Egy részeg ember zavarta meg az EP-választást Szlovákiában,Nagyszombaton történt az eset.,https://index.hu/kulfold/ep/2024/valasztas/2024/06/08/szlovakia-europai-parlamenti-valasztas-poprad-totmegyer-nagyszombat-rendorseg-incidens-reszeg/
,,Hivatalosan is átadták a Vaskupola magyar lokátorát,Több mint ezer célpontot tudnak követni ezek a lokátorok.,https://index.hu/belfold/2024/06/08/magyar-honvedseg-vaskupola-veszprem-lokator/
,,"Ukrajna döntést hozott, hamarosan új átkelő nyílhat az ukrán–magyar határon",Többéves huzavona végére kerülhet pont.,https://index.hu/kulfold/2024/06/08/ukrajna-denisz-smihal-miniszterelnok-magyarorszag-lengyelorszag-hatarmenti-infrastruktura-fejlesztes-moldova-szlovakia/
,,Ökölvívásban ezt kiütésnek hívják: Swiatek elképesztő fölénnyel nyerte meg a Garrost,Az olasz Paolini mindössze három játékot tudott nyerni a mérkőzésen.,https://index.hu/sport/tenisz/2024/06/08/roland-garros-2024-noi-egyes-donto-iga-swiatek-jasmine-paolini-helyszini-osszefoglalo/
,,Több mint 100 ezerrel nőtt a nemzetiségi választópolgárok száma tíz év alatt,A legtöbben a roma nemzetiség névjegyzékébe regisztráltak.,https://index.hu/kulfold/ep/2024/valasztas/2024/06/08/nemzeti-valasztasi-iroda-nemzetisegi-valasztok-szamanak-novekedese-100-ezer-fo/
,,Még a börtönökben is szavaznak vasárnap,"Az antifa támadások vádlottja azt állította, megtiltották, hogy leadja a voksát, reagált a parancsnokság.",https://index.hu/belfold/2024/onkormanyzati_valasztas/2024/06/08/bvop-valasztas-borton-ilaria-salis/
,,A Premier League korábbi legendás támadója ülhet le a Ferencváros kispadjára,Saját maga kérte szerződése felbontását klubjánál.,https://index.hu/sport/futball/2024/06/08/robbie-keane-maccabi-tel-aviv-ferencvaros-sajtoertesules-vezetoedzo/
,,"Meghalt a Star Trek, a Halálos fegyver 3. és a Dupla dinamit színésze",„Nagyszerű klasszikus színész akartam lenni” – mondta Alan Scarfe.,https://index.hu/kultur/2024/06/08/halal-szinesz-alan-scarfe-halalos-fegyver-dupla-dinamit-film-meghalt-star-trek/
,,Alföldi Róbert gusztustalannak nevezte Szentkirályi Alexandra visszalépését,A Jászai Mari-díjas színész nem fogta vissza a véleményét.,https://index.hu/belfold/2024/onkormanyzati_valasztas/2024/06/08/alfoldi-robert-szentkiralyi-alexandra-fidesz-vitezy-david/
,,Új fotót posztolt Robert Fico: a szlovák kormányfő a kórházban adta le szavazatát,"Szerinte olyan képviselőkre kell szavazni, akik nem a háborút, hanem a békét támogatják.",https://index.hu/kulfold/2024/06/08/robert-fico-europai-parlamenti-valsztas-szlovakia-korhaz-facebook-poszt/
,,"Álommelót hirdetett az IKEA, mostantól videójátékban is dolgozhatnak nekik",A virtuális hot dog és húsgolyó kiszolgálásáért is tisztességes fizetés jár.,https://index.hu/fomo/2024/06/08/ikea-roblox-videojatek-munka-aruhaz-husgolyo-hot-dog/
,,Toroczkai László: Ebben a harcban először Budapest fog elbukni,A Mi Hazánk egy új európai tömörülést szeretne létrehozni.,https://index.hu/kulfold/ep/2024/valasztas/2024/06/08/toroczkai-laszlo-mi-hazank-kampany-budapest/
,,Megfosztják kinevezésétől a bántalmazó rappert,"„Undorodtam, amikor megtettem. Most is undorodom"" – mondta.",https://index.hu/kultur/2024/06/08/sean-p-diddy-combs-tiszteletbeli-diploma-howard-egyetem-botrany-eroszak-megfosztas/
,,"Annyira öregszik társadalmunk, hogy egyre inkább függ a munkaerőpiac az idősebbektől",Folyamatosan erősödik a munkaerőhiány.,https://index.hu/gazdasag/geocompass/2024/06/08/munkaeropiac-foglalkoztatas-munkavallalas-idosek-idosek-foglalkoztatasa/
,,Minden kampányeseményét lemondta a megtámadott dán kormányfő,"Könnyebb sérüléseket szerzett, de jól van a dán miniszterelnök.",https://index.hu/kulfold/2024/06/08/dania-mette-frederiksen-tamadas-kampany-kampanyhajra-koppenhaga/
,,"Vitézy Dávid elmondta, hogy támogatja-e őt a kormány",Szerinte az utolsó napokban agresszívvá vált a kampány.,https://index.hu/belfold/2024/onkormanyzati_valasztas/2024/06/08/vitezy-david-fopolgarmester-jelolt-varosfejlesztes-budapest-kampany/
,,A közvélemény-kutatók szerint ő lesz a következő főpolgármester,Mindössze pár százalékpont a különbség a két jelölt között.,https://index.hu/belfold/2024/onkormanyzati_valasztas/2024/06/08/budapest-karacsony-gergely-vitezy-david-grundtner-andras-publicus-intezet-nezopont-intezet-kozvelemeny-kutatas/
,,"Besenyei Péter: Úgy hittem, a repülés a kiváltságos emberek tevékenysége","Elmondta, hogyan került életveszélyes szituációba korábban Kanadában.",https://index.hu/fomo/2024/06/08/besenyei-peter-pilota-murepules-nyugdij-aktiv-elet/
,,Így fog kinézni az emberi arc 20 ezer év múlva,Hacsak be nem avatkozunk.,https://index.hu/tudomany/til/2024/06/08/igy-fog-kinezni-az-emberi-arc-20-ezer-ev-mulva/
,,"Megsérült a lengyelek gólvágója, nélküle utaznak az Európa-bajnokságra",Az utolsó felkészülési mérkőzésen érte a baj.,https://index.hu/sport/futball/2024/eb/2024/06/08/europa-bajnoksag-2024-lengyel-valogatott-arkadiusz-milik-kerethirdetes/
Németh Márton Sándor,2024.06.08. 13:53,Magyar Péter: Többször hibáztam,"A Hősök terén egyre többen lesznek rosszul a nagy hőségben, a színpadról jelezték, hogy orvosra van szükség.",https://index.hu/belfold/2024/06/08/magyar-peter-valasztas-tisza-part-tuntetes-demonstracio/
,,Ezekben az órákban tetőzik a Duna Budapestnél,Az újabb esőzések a jelenlegi árhullám levonulását már nem befolyásolják.,https://index.hu/belfold/2024/06/08/arvizvedelmi-vedekezes-duna/
,,"Joe Biden szerint úgy kell harcolni a demokráciáért, mint a második világháborúban",Az amerikai elnök Normandiában tartott beszédet.,https://index.hu/kulfold/2024/06/08/egyesult-allamok-joe-biden-volodimir-zelenszkij-d-nap-masodik-vilaghaboru-normandia-beszed-ukrajnai-haboru/
,,"Kiszabadítottak négy, a zenei fesztiválról elhurcolt túszt a Gázai övezetből",Még így is többtucatnyit tart fogva a Hamász.,https://index.hu/kulfold/2024/06/08/izrael-hamasz-terrorszervezet-gazai-ovezet-foglyok-izraeli-vedelmi-erok-idf/
,,Ezen a településen érdeklődés hiányában elmarad az önkormányzati választás,Az egyetlen jelölt visszalépett.,https://index.hu/belfold/2024/onkormanyzati_valasztas/2024/06/08/magyarorszag-bozsok-vas-varmegye-onkormanyzati-valasztas-nemzeti-valasztasi-iroda/
,,"Céline Dion olyan erős izomgörcsöktől szenvedett, hogy eltörtek a bordái",A stiff-person-szindrómában szenvedő énekesnő a diagnózis felállítása óta először adott tévéinterjút.,https://index.hu/kultur/2024/06/08/celine-dion-betegseg-enekesno-zene-muvesz-sztar/
,,"Ungár Péter: Márki-Zay Péter egy futóbolond, távozzon a közéletből!",A hódmezővásárhelyi polgármester szerint Vitézy Dávid egy „nyíltan meleg” polgármester.,https://index.hu/belfold/2024/onkormanyzati_valasztas/2024/06/08/ungar-peter-lmp-marki-zay-peter-karacsony-gergely-vitezy-david-fopolgarmester-valasztas/
,,"Meg akarta ölni az osztálytársait, kést rántott tanóra közben egy általános iskolás Sajókazán","Tizenegy centiméter pengehosszúságú konyhakést vett elő, amit a nyelvén húzogatott.",https://index.hu/belfold/2024/06/08/iskola-fiatal-osztalytars-kes-fenyegetes-sajokaza-miskolc-miskolci-torvenyszek-tanar/
,,A hónap magyar asztrofotója: A nagy napfolt,A május eleji sarkifény-jelenséget előidéző napfoltcsoportról készült a kép.,https://index.hu/kultur/2024/06/08/a-honap-magyar-asztrofotoja-nagyfelbontasu-kep-napfoltcsoport/
,,"Orbán Viktor: Padlógáz, mert a tét hatalmas","A miniszterelnök kijelentette, hogy az egész országot mozgósítják.",https://index.hu/belfold/2024/onkormanyzati_valasztas/2024/06/08/orban-viktor-miniszterelnok-szolnok-kampany-korut/
,,"Minden idők legtöbb helyszínén, 99 országban adhatják le szavazataikat a magyarok",Összesen 21 458 állampolgár kíván külföldön szavazni.,https://index.hu/kulfold/ep/2024/valasztas/2024/06/08/kulkepviselet-szavazas-egyesult-allamok-szijjarto-peter/
,,Teljesen normális dolog megálmodni a jövőt,Alvás közben próbál a jövőbe látni az agy.,https://index.hu/techtud/2024/06/08/agy-alom-prekognicio-jovobelatas-agykutatas-patkany-idegsejt-gepi-tanulas/
