title,source,published
"Özönvízszerű esőzés fenyeget, riasztást adott ki a meteorológia",Infostart.hu,2024-06-03T14:26:00Z
Kiadták a figyelmeztetést: Gumicsizmára és csónakra is szükség lehet!,Index.hu,2024-06-03T11:30:00Z
"Ciklon érkezik, kiadták a riasztást: viharos szélroham, villámárvíz és jégeső jön",Portfolio,2024-06-03T12:18:00Z
Felhőszakadás és zivatar miatt másodfokú riasztást adtak ki több délnyugati járásra,hvg.hu,2024-06-03T16:15:36Z
"A világ legbefolyásosabb vezetőinek ugrott neki Zelenszkij, elesett Umanszke - Háborús híreink hétfőn",Portfolio,2024-06-03T16:57:00Z
Külföld - Oroszország háborúja Ukrajnában – az Index hétfői hírösszefoglalója - Percről percre,Index.hu,2024-06-03T19:30:00Z
"Kérdéses, hogy Orbán Viktor elmegy-e a svájci békekonferenciára",Infostart.hu,2024-06-03T15:13:00Z
Zelenszkij ezúttal nagyon messzire ment + videó,Magyar Nemzet,2024-06-03T07:03:15Z
Négyre nőtt a németországi árvíz halálos áldozatainak száma,Index.hu,2024-06-03T19:32:00Z
"Összeszorulhat a szíve, ha meglátja, mennyit ér a forint",Menedzsment Fórum,2024-06-03T05:44:00Z
